<?xml version="1.0" encoding="UTF-8"?>
<schema xmlns="http://www.w3.org/2001/XMLSchema" targetNamespace="http://dlvmechanografie.eu/DiamondBoardsConfig"
	xmlns:tns="http://dlvmechanografie.eu/DiamondBoardsConfig"
	elementFormDefault="qualified">

	<element name="boards">
		<complexType>
			<sequence minOccurs="1" maxOccurs="unbounded">
				<choice>
					<element name="opalmm" type="tns:opalmmType" />
					<element name="dmmat" type="tns:dmmatType" />
					<element name="opmm1616" type="tns:opmm1616Type" />
				</choice>
			</sequence>
		</complexType>
	</element>

	<complexType name="boardStruct" abstract="true">
		<attribute name="board" type="int" use="required" />
		<attribute name="address" type="string" use="required" />
		<attribute name="desc" type="string" />
	</complexType>
	<complexType name="boardChannelStruct">
		<attribute name="channel" type="int" use="required" />
		<attribute name="logical-id" type="string" use="optional" />
	</complexType>
	<complexType name="channel0to7Struct">
		<sequence minOccurs="1" maxOccurs="8">
			<element name="channel" type="tns:boardChannelStruct" />
		</sequence>
	</complexType>
	<complexType name="channel0to15Struct">
		<sequence minOccurs="1" maxOccurs="16">
			<element name="channel" type="tns:boardChannelStruct" />
		</sequence>
	</complexType>
	<complexType name="channel0to1Struct">
		<sequence minOccurs="1" maxOccurs="2">
			<element name="channel" type="tns:boardChannelStruct" />
		</sequence>
	</complexType>

	<complexType name="opalmmType">
		<complexContent>
			<extension base="tns:boardStruct">
				<sequence>
					<element name="digital-input" type="tns:channel0to7Struct"
						minOccurs="0" />
					<element name="digital-output" type="tns:channel0to7Struct"
						minOccurs="0" />
				</sequence>
			</extension>
		</complexContent>
	</complexType>
	<complexType name="opmm1616Type">
		<complexContent>
			<extension base="tns:boardStruct">
				<sequence>
					<element name="digital-input" type="tns:channel0to15Struct"
						minOccurs="0" />
					<element name="digital-output" type="tns:channel0to15Struct"
						minOccurs="0" />
				</sequence>
			</extension>
		</complexContent>
	</complexType>
	<complexType name="dmmatType">
		<complexContent>
			<extension base="tns:boardStruct">
				<sequence>
					<element name="analog-input" type="tns:channel0to1Struct"
						minOccurs="0" />
					<element name="analog-output" type="tns:channel0to1Struct"
						minOccurs="0" />
					<element name="digital-input" type="tns:channel0to7Struct"
						minOccurs="0" />
					<element name="digital-output" type="tns:channel0to7Struct"
						minOccurs="0" />
				</sequence>
			</extension>
		</complexContent>
	</complexType>
</schema>