<?xml version="1.0" encoding="UTF-8"?>
<boards xmlns="http://dlvmechanografie.eu/DiamondBoardsConfig" xmlns:xsi="http://www.w3.org/2001/XMLSchema-instance"
	xsi:schemaLocation="http://dlvmechanografie.eu/DiamondBoardsConfig ../../main/resources/DiamondBoardsConfig.xsd ">
	<dmmat board="0" address="0x330" desc="Board 0, dmmatt.">
		<analog-input>
			<channel channel="0" logical-id="AnalogIn" />
		</analog-input>
		<analog-output>
			<channel channel="0" logical-id="LichtVeranda" />
			<channel channel="1" logical-id="LichtCircanteRondom" />
		</analog-output>
		<digital-input>
			<channel channel="0" logical-id="SchakLichtKeuken" />
			<channel channel="1" logical-id="SchakScreenKeukenDown" />
			<channel channel="2" logical-id="SchakScreenKeukenUp" />
			<channel channel="3" logical-id="SchakLichtBadk0" />
			<channel channel="4" logical-id="SchakVentilatorBadk0" />
			<channel channel="5" logical-id="SchakScreenZuidUp" />
			<channel channel="6" logical-id="SchakScreenZuidDown" />
			<channel channel="7" logical-id="SchakSlaapZuidWand" />
		</digital-input>
		<digital-output>
			<channel channel="0" logical-id="LichtBureau" />
			<channel channel="1" logical-id="LichtCircante" />
			<channel channel="2" logical-id="LichtInkom" />
			<channel channel="3" logical-id="VentilatorWC0" />
			<channel channel="4" logical-id="LichtWC0" />
			<channel channel="5" logical-id="VentilatorBadk0" />
			<channel channel="6" logical-id="LichtBadk1" />
			<channel channel="7" logical-id="LichtBadk0" />
		</digital-output>
	</dmmat>
	<dmmat board="1" address="0x300" desc="Board 1, dmmatt.">
		<analog-output>
			<channel channel="0" logical-id="LichtZithoek" />
			<channel channel="1" />
		</analog-output>
		<digital-input>
			<channel channel="0" logical-id="Windmeter" />
			<channel channel="7" logical-id="SchakBuitenTuin" />
		</digital-input>
	</dmmat>
	<opmm1616 board="2" address="0x200" desc="Board 2, opmm1616.">
		<digital-input>
			<channel channel="0" logical-id="SchakLichtVerandaDown" />
			<channel channel="1" logical-id="SchakLichtVerandaUp" />
			<channel channel="2" logical-id="SchakScreenLangDown" />
			<channel channel="3" logical-id="SchakScreenLangUp" />
			<channel channel="4" logical-id="SchakScreenBreedDown" />
			<channel channel="5" logical-id="SchakScreenBreedUp" />
			<channel channel="6" logical-id="SchakScreenAllDown" />
			<channel channel="7" logical-id="SchakScreenAllUp" />
			<channel channel="8" logical-id="SchakVentilatorWC0" />
			<channel channel="9" logical-id="SchakLichtBureau" />
			<channel channel="10" logical-id="SchakLichtZithoekDown" />
			<channel channel="11" logical-id="SchakLichtZithoekUp" />
			<channel channel="12" logical-id="SchakLichtCircanteRondomDown" />
			<channel channel="13" logical-id="SchakLichtCircanteRondomUp" />
			<channel channel="14" logical-id="SchakLichtCircante" />
			<channel channel="15" logical-id="SchakLichtInkom" />
		</digital-input>
		<digital-output>
			<channel channel="0" logical-id="ScreenSlaapNoordDown" />
			<channel channel="1" logical-id="LichtGangBoven" />
			<channel channel="2" logical-id="LichtSlaapZuidSpots" />
			<!-- LichtSlaapZuidWand aansluiting is weggestopt achter pleister -->
			<channel channel="3" logical-id="LichtSlaapZuidWand" /> 
			<channel channel="4" logical-id="LichtSlaapZuidwestSpots" />
			<channel channel="5" logical-id="LichtSlaapZuidwestWand" />
			<channel channel="6" logical-id="LichtSlaapNoordSpots" />
			<channel channel="7" logical-id="LichtSlaapNoordWand" />
			<channel channel="8" logical-id="LichtKeuken" />
			<channel channel="9" logical-id="LichtGaragePoort" />
			<channel channel="10" logical-id="LichtGarageTuin" />
			<channel channel="11" logical-id="ScreenLangUp" />
			<channel channel="12" logical-id="ScreenLangDown" />
			<channel channel="13" logical-id="ScreenBreedUp" />
			<channel channel="14" logical-id="ScreenBreedDown" />
			<channel channel="15" logical-id="ScreenKeukenDown" />
		</digital-output>
	</opmm1616>
	<opalmm board="3" address="0x240" desc="Board 3, opalmm 8.">
		<digital-input>
			<channel channel="0" logical-id="SchakScreenZuidwestTuinDown" />
			<channel channel="1" logical-id="SchakScreenZuidwestTuinUp" />
			<channel channel="2" logical-id="SchakScreenZuidwestOpzijDown" />
			<channel channel="3" logical-id="SchakScreenZuidwestOpzijUp" />
			<channel channel="4" logical-id="SchakSlaapNoordWand" />
			<channel channel="5" logical-id="SchakSlaapNoordSpots" />
			<channel channel="6" logical-id="SchakSlaapZuidSpots" />
			<channel channel="7" logical-id="SchakLichtWC0" />
		</digital-input>
		<digital-output>
			<channel channel="0" logical-id="LichtNacht" />
			<channel channel="1" logical-id="IndicLichtNacht" /><!-- indicator licht nacht -->
			<channel channel="2" logical-id="LichtTerras" />
			<channel channel="3" logical-id="IndicScreenAuto" /><!-- tobe indicator screen-automaat aan/uit -->
			<channel channel="4" logical-id="StopkBuiten" />
			<channel channel="5" logical-id="IndicWindZon" /><!-- tobe indicator zon(aan) / teveel-wind(knipperen) bij automaat aan -->
			<channel channel="6" logical-id="StopkCarport" />
			<channel channel="7" /><!-- TODO domotica functioneert, lampje in kast -->
		</digital-output>
	</opalmm>
	<opalmm board="4" address="0x280" desc="Board 4, opalmm 8.">
		<digital-input>
			<channel channel="0" logical-id="SchakLichtGaragePoort" />
			<channel channel="1" logical-id="SchakLichtGarageTuin" />
			<channel channel="2" logical-id="SchakLichtBadk1" />
			<channel channel="3" logical-id="SchakSlaapZuidwestSpots" />
			<channel channel="4" logical-id="SchakSlaapZuidwestWand" />
			<channel channel="5" logical-id="SchakLichtGangBoven" />
			<channel channel="6" logical-id="SchakScreenSlaapNoordDown" />
			<channel channel="7" logical-id="SchakScreenSlaapNoordUp" />
		</digital-input>
		<digital-output>
			<channel channel="0" logical-id="ScreenSlaapNoordUp" />
			<channel channel="1" logical-id="ScreenZuidwestOpzijDown" />
			<channel channel="2" logical-id="ScreenZuidwestOpzijUp" />
			<channel channel="3" logical-id="ScreenZuidwestTuinUp" />
			<channel channel="4" logical-id="ScreenZuidwestTuinDown" />
			<channel channel="5" logical-id="ScreenZuidDown" />
			<channel channel="6" logical-id="ScreenZuidUp" />
			<channel channel="7" logical-id="ScreenKeukenUp" />
		</digital-output>
	</opalmm>
</boards>
