<?xml version="1.0" encoding="UTF-8"?>
<boards xmlns="http://dlvmechanografie.eu/DiamondBoardsConfig"
	xmlns:xsi="http://www.w3.org/2001/XMLSchema-instance"
	xsi:schemaLocation="http://dlvmechanografie.eu/DiamondBoardsConfig ../../main/resources/DiamondBoardsConfig.xsd ">
	<opalmm address="0x380" board="0" desc="Een opalmm bordje.">
		<digital-input>
			<channel channel="5" logical-id="87" />
		</digital-input>
		<digital-output>
			<channel channel="2" logical-id="13" />
		</digital-output>
	</opalmm>
	<dmmat board="1" address="0x400" desc="First dmmatt board">
		<analog-output>
			<channel channel="0" logical-id="10" />
		</analog-output>
	</dmmat>
	<opmm1616 board="2" address="0x410" desc="Third board, opmm1616">
		<digital-input>
			<channel channel="5" logical-id="100" />
			<channel channel="6" logical-id="101" />
			<channel channel="7" logical-id="102" />
			<channel channel="8" logical-id="103" />
			<channel channel="9" logical-id="104" />
			<channel channel="10" logical-id="105" />
			<channel channel="11" logical-id="106" />
			<channel channel="12" logical-id="107" />
			<channel channel="13" logical-id="108" />
			<channel channel="14" logical-id="109" />
			<channel channel="0" logical-id="110" />
			<channel channel="15" logical-id="111" />
		</digital-input>
		<digital-output>
			<channel channel="2" logical-id="120" />
		</digital-output>
	</opmm1616>

</boards>
