<?xml version="1.0" encoding="UTF-8"?>
<boards xmlns="http://dlvmechanografie.eu/DiamondBoardsConfig" xmlns:xsi="http://www.w3.org/2001/XMLSchema-instance"
	xsi:schemaLocation="http://dlvmechanografie.eu/DiamondBoardsConfig DiamondBoardsConfig.xsd ">
	<dmmat board="0" address="0x330" desc="Board 0, dmmatt.">
		<analog-input>
			<channel channel="0" logical-id="AnalogIn" />
		</analog-input>
		<analog-output>
			<channel channel="0" logical-id="LichtVeranda" />
			<channel channel="1" logical-id="LichtCircanteRondom" />
		</analog-output>
		<digital-input>
			<channel channel="0" logical-id="SchakLichtKeuken" />
			<channel channel="1" logical-id="SchakScreenKeukenDown" />
			<channel channel="2" logical-id="SchakScreenKeukenUp" />
			<channel channel="3" logical-id="SchakLichtBadk0" />
			<channel channel="4" logical-id="SchakVentilatorBadk0" />
			<channel channel="5" logical-id="SchakScreenTomasUp" />
			<channel channel="6" logical-id="SchakScreenTomasDown" />
			<channel channel="7" logical-id="SchakLichtTomasWand" /><!-- TODO Was SchakLichtTomas, bedoeld spots, maar bleek andersom -->
		</digital-input>
		<digital-output>
			<channel channel="0" logical-id="LichtBureau" />
			<channel channel="1" logical-id="LichtCircante" />
			<channel channel="2" logical-id="LichtInkom" />
			<channel channel="3" logical-id="VentilatorWC0" />
			<channel channel="4" logical-id="LichtWC0" />
			<channel channel="5" logical-id="VentilatorBadk0" />
			<channel channel="6" logical-id="LichtBadk1" />
			<channel channel="7" logical-id="LichtBadk0" />
		</digital-output>
	</dmmat>
	<dmmat board="1" address="0x300" desc="Board 1, dmmatt.">
		<analog-output>
			<channel channel="0" logical-id="LichtZithoek" />
			<channel channel="1" />
		</analog-output>
		<digital-input>
			<channel channel="0" logical-id="Windmeter" />
			<channel channel="7" logical-id="SchakBuitenTuin" />
		</digital-input>
	</dmmat>
	<opmm1616 board="2" address="0x200" desc="Board 2, opmm1616.">
		<digital-input>
			<channel channel="0" logical-id="SchakLichtVerandaDown" />
			<channel channel="1" logical-id="SchakLichtVerandaUp" />
			<channel channel="2" logical-id="SchakScreenLangDown" />
			<channel channel="3" logical-id="SchakScreenLangUp" />
			<channel channel="4" logical-id="SchakScreenBreedDown" />
			<channel channel="5" logical-id="SchakScreenBreedUp" />
			<channel channel="6" logical-id="SchakScreenAllDown" />
			<channel channel="7" logical-id="SchakScreenAllUp" />
			<channel channel="8" logical-id="SchakVentilatorWC0" />
			<channel channel="9" logical-id="SchakLichtBureau" />
			<channel channel="10" logical-id="SchakLichtZithoekDown" />
			<channel channel="11" logical-id="SchakLichtZithoekUp" />
			<channel channel="12" logical-id="SchakLichtCircanteRondomDown" />
			<channel channel="13" logical-id="SchakLichtCircanteRondomUp" />
			<channel channel="14" logical-id="SchakLichtCircante" />
			<channel channel="15" logical-id="SchakLichtInkom" />
		</digital-input>
		<digital-output>
			<channel channel="0" logical-id="ScreenRoosDown" />
			<channel channel="1" logical-id="LichtGangBoven" />
			<channel channel="2" logical-id="LichtTomasSpots" />
			<channel channel="3" logical-id="LichtTomasWand" />
			<channel channel="4" logical-id="LichtDries" />
			<channel channel="5" logical-id="LichtDriesWand" />
			<channel channel="6" logical-id="LichtRoos" />
			<channel channel="7" logical-id="LichtRoosWand" />
			<channel channel="8" logical-id="LichtKeuken" />
			<channel channel="9" logical-id="LichtGaragePoort" />
			<channel channel="10" logical-id="LichtGarageTuin" />
			<channel channel="11" logical-id="ScreenLangUp" />
			<channel channel="12" logical-id="ScreenLangDown" />
			<channel channel="13" logical-id="ScreenBreedUp" />
			<channel channel="14" logical-id="ScreenBreedDown" />
			<channel channel="15" logical-id="ScreenKeukenDown" />
		</digital-output>
	</opmm1616>
	<opalmm board="3" address="0x240" desc="Board 3, opalmm 8.">
		<digital-input>
			<channel channel="0" logical-id="SchakScreenDriesTuinDown" />
			<channel channel="1" logical-id="SchakScreenDriesTuinUp" />
			<channel channel="2" logical-id="SchakScreenDriesOpzijDown" />
			<channel channel="3" logical-id="SchakScreenDriesOpzijUp" />
			<channel channel="4" logical-id="SchakLichtRoosWand" />
			<channel channel="5" logical-id="SchakLichtRoos" />
			<channel channel="6" logical-id="SchakLichtTomasSpots" /><!-- TODO Was: SchakLichtTomasWand; check kabel -->
			<channel channel="7" logical-id="SchakLichtWC0" />
		</digital-input>
		<digital-output>
			<channel channel="0" logical-id="LichtNacht" />
			<channel channel="1" logical-id="IndicLichtNacht" /><!-- indicator licht nacht -->
			<channel channel="2" logical-id="LichtTerras" />
			<channel channel="3" logical-id="IndicScreenAuto" /><!-- tobe indicator screen-automaat aan/uit -->
			<channel channel="4" logical-id="StopkBuiten" />
			<channel channel="5" logical-id="IndicWindZon" /><!-- tobe indicator zon(aan) / teveel-wind(knipperen) bij automaat aan -->
			<channel channel="6" logical-id="StopkCarport" />
			<channel channel="7" /><!-- TODO domotica functioneert, lampje in kast -->
		</digital-output>
	</opalmm>
	<opalmm board="4" address="0x280" desc="Board 4, opalmm 8.">
		<digital-input>
			<channel channel="0" logical-id="SchakLichtGaragePoort" />
			<channel channel="1" logical-id="SchakLichtGarageTuin" />
			<channel channel="2" logical-id="SchakLichtBadk1" />
			<channel channel="3" logical-id="SchakLichtDries" />
			<channel channel="4" logical-id="SchakLichtDriesWand" />
			<channel channel="5" logical-id="SchakLichtGangBoven" />
			<channel channel="6" logical-id="SchakScreenRoosDown" />
			<channel channel="7" logical-id="SchakScreenRoosUp" />
		</digital-input>
		<digital-output>
			<channel channel="0" logical-id="ScreenRoosUp" />
			<channel channel="1" logical-id="ScreenDriesOpzijDown" />
			<channel channel="2" logical-id="ScreenDriesOpzijUp" />
			<channel channel="3" logical-id="ScreenDriesTuinUp" />
			<channel channel="4" logical-id="ScreenDriesTuinDown" />
			<channel channel="5" logical-id="ScreenTomasDown" />
			<channel channel="6" logical-id="ScreenTomasUp" />
			<channel channel="7" logical-id="ScreenKeukenUp" />
		</digital-output>
	</opalmm>
</boards>
