<?xml version="1.0" encoding="UTF-8"?>
<boards xmlns="http://dlvmechanografie.eu/DiamondBoardsConfig"
	xmlns:xsi="http://www.w3.org/2001/XMLSchema-instance"
	xsi:schemaLocation="http://dlvmechanografie.eu/DiamondBoardsConfig ../../main/resources/DiamondBoardsConfig.xsd ">
	<opalmm board="0" address="0x300" desc="OPALMM 0 - enkel output.">
		<digital-output>
			<channel channel="2" logical-id="0" />
		</digital-output>
	</opalmm>
	<opalmm board="1" address="0x310" desc="OPALMM 1 - enkel input">
		<digital-input>
			<channel channel="5" logical-id="1" />
		</digital-input>
	</opalmm>
	<dmmat board="2" address="0x400"
		desc="DMMAT 1 - analog input enkel channel 0, analog output beide kanalen.">
		<analog-input>
			<channel channel="0" logical-id="10" />
		</analog-input>
		<analog-output>
			<channel channel="0" logical-id="11" />
			<channel channel="1" logical-id="12" />
		</analog-output>
	</dmmat>
	<dmmat board="3" address="0x410"
		desc="DMMAT 2 - analog output enkel channel 1; digitaal in en uit.">
		<analog-output>
			<channel channel="1" logical-id="30" />
		</analog-output>
		<digital-input>
			<channel channel="0" logical-id="31" />
		</digital-input>
		<digital-output>
			<channel channel="0" logical-id="32" />
			<channel channel="7" logical-id="33" />
		</digital-output>
	</dmmat>
	<dmmat board="4" address="0x420"
		desc="DMMAT 2 - analog input enkel channel 1, output beide kanalen; digitaal in en uit.">
		<analog-input>
			<channel channel="1" logical-id="20" />
		</analog-input>
		<analog-output>
			<channel channel="0" logical-id="21" />
			<channel channel="1" logical-id="22" />
		</analog-output>
		<digital-input>
			<channel channel="0" logical-id="23" />
		</digital-input>
		<digital-output>
			<channel channel="0" logical-id="24" />
			<channel channel="5" logical-id="25" />
		</digital-output>
	</dmmat>
</boards>
